{
  "artifact_id": "ww2_av_003",
  "collection_id": "ww2",
  "artifact_type": "A-roll",
  "role": "body",

  "file": {
    "filename": "ww2_av_003.mp4",
    "format": "mp4",
    "duration_seconds": 24.5,
    "has_video": true,
    "has_audio": true,
    "resolution": "1920x1080",
    "source": "public-domain",
    "copyright_cleared": true
  },

  "content": {
    "title": "Soldiers marching through village",
    "description": "Black and white footage of soldiers moving through a destroyed village, with ambient sounds of distant artillery in the background",
    "theme": ["war", "movement", "destruction", "soldiers"],
    "mood": "somber",
    "pacing": "slow",
    "tags": ["black-and-white", "exterior", "ambient-audio", "movement", "infantry"],
    "dominant_colors": ["gray", "brown", "black"],
    "dominant_lines": "horizontal"
  },

  "sequencing": {
    "can_repeat": false,
    "min_gap_seconds": 120,
    "must_follow": [],
    "must_not_follow": ["ww2_av_007"],
    "weight": 0.8
  },

  "ai_enrichment": {
    "auto_tagged": true,
    "enrichment_date": "2025-06-04",
    "suggested_tags": ["archival", "ground-troops", "rubble"],
    "confidence_score": 0.91
  },

  "created_at": "2025-06-04T10:00:00Z",
  "updated_at": "2025-06-04T10:00:00Z"
}
